{"_D":"urn:oasis:names:specification:ubl:schema:xsd:TransportServiceDescription-2",
 "_A":"urn:oasis:names:specification:ubl:schema:xsd:CommonAggregateComponents-2",
 "_B":"urn:oasis:names:specification:ubl:schema:xsd:CommonBasicComponents-2",
 "TransportServiceDescription":{
 "UBLVersionID":{"_":"2.1"},
 "ID":{"_":"TSD_RESP_1"},
 "IssueDate":{"_":"2011-09-12"},
 "IssueTime":{"_":"11:01:10+01:00"},
 "SenderParty":{
  "PartyIdentification":[{
   "ID":{"_":"4058673827641",
    "schemeAgencyName":"GS1",
    "schemeName":"GLN"}
  }],
  "PartyName":[{
   "Name":{"_":"NECOSS"}
  }],
  "Contact":{
   "Name":{"_":"SomeName"},
   "Telephone":{"_":"+49450557000"},
   "ElectronicMail":{"_":"SomeName@necoss.de"}
  }
 },
 "ReceiverParty":{
  "PartyIdentification":[{
   "ID":{"_":"4058673827000",
    "schemeAgencyName":"GS1",
    "schemeName":"GLN"}
  }],
  "PartyName":[{
   "Name":{"_":"Consignor"}
  }],
  "Contact":{
   "Name":{"_":"SomeName"},
   "Telephone":{"_":"+8687878763"},
   "ElectronicMail":{"_":"SomeName@consignor.cn"}
  }
 },
 "TransportServiceDescriptionRequestDocumentReference":{
  "ID":{"_":"TSD_REQ_1"}
 },
 "TransportServiceProviderParty":{
  "PartyIdentification":[{
   "ID":{"_":"4058673827641",
    "schemeAgencyName":"GS1",
    "schemeName":"GLN"}
  }],
  "PartyName":[{
   "Name":{"_":"NECOSS"}
  }],
  "Contact":{
   "Name":{"_":"SomeName"},
   "Telephone":{"_":"+49450557000"},
   "ElectronicMail":{"_":"SomeName@necoss.de"}
  }
 },
 "ServiceChargePaymentTerms":{
  "Amount":{"_":2500,
   "currencyID":"EUR"},
  "PaymentDueDate":{"_":"2011-11-06"}
 },
 "ValidityPeriod":{
  "StartDate":{"_":"2011-09-12"},
  "EndDate":{"_":"2011-09-30"},
  "EndTime":{"_":"16:00:00+01:00"}
 },
 "TransportationService":[{
  "TransportServiceCode":{"_":"3"},
  "SupportedTransportEquipment":[{
   "ID":{"_":"1"},
   "TransportEquipmentTypeCode":{"_":"CN"},
   "MeasurementDimension":[{
    "AttributeID":{"_":"Length"},
    "Measure":{"_":6.1,
     "unitCode":"MTR"}
   },{
    "AttributeID":{"_":"Height"},
    "Measure":{"_":2.6,
     "unitCode":"MTR"}
   },{
    "AttributeID":{"_":"Width"},
    "Measure":{"_":2.44,
     "unitCode":"MTR"}
   }]
  },{
   "ID":{"_":"1"},
   "TransportEquipmentTypeCode":{"_":"CN"},
   "MeasurementDimension":[{
    "AttributeID":{"_":"Length"},
    "Measure":{"_":6.1,
     "unitCode":"MTR"}
   },{
    "AttributeID":{"_":"Height"},
    "Measure":{"_":2.6,
     "unitCode":"MTR"}
   },{
    "AttributeID":{"_":"Width"},
    "Measure":{"_":2.44,
     "unitCode":"MTR"}
   }]
  }],
  "ShipmentStage":[{
   "ID":{"_":"1"},
   "PlannedDepartureTransportEvent":{
    "Location":{
     "Address":{
      "ID":{"_":"DEHAM",
       "schemeAgencyName":"UN",
       "schemeName":"UN/LOCODE"},
      "StreetName":{"_":"Neuer Wandrahm 4"},
      "CityName":{"_":"Hamburg"},
      "Country":{
       "IdentificationCode":{"_":"DE"}
      }
     }
    },
    "Period":[{
     "StartDate":{"_":"2011-10-03"},
     "StartTime":{"_":"09:30:10+01:00"},
     "EndDate":{"_":"2011-10-03"},
     "EndTime":{"_":"12:30:10+01:00"}
    }]
   },
   "PlannedArrivalTransportEvent":{
    "Location":{
     "LocationTypeCode":{"_":"13"},
     "Address":{
      "ID":{"_":"4568763527610",
       "schemeAgencyName":"GS1",
       "schemeName":"GLN"},
      "StreetName":{"_":"Ludwig-Erhard-Str. 15"},
      "CityName":{"_":"Bremen"},
      "Country":{
       "IdentificationCode":{"_":"DE"}
      }
     }
    },
    "Period":[{
     "StartDate":{"_":"2011-10-03"},
     "StartTime":{"_":"18:30:10+01:00"},
     "EndDate":{"_":"2011-10-03"},
     "EndTime":{"_":"21:30:10+01:00"}
    }]
   }
  },{
   "ID":{"_":"2"},
   "PlannedDepartureTransportEvent":{
    "Location":{
     "LocationTypeCode":{"_":"13"},
     "Address":{
      "ID":{"_":"4568763527610",
       "schemeAgencyName":"GS1",
       "schemeName":"GLN"},
      "StreetName":{"_":"Ludwig-Erhard-Str. 15"},
      "CityName":{"_":"Bremen"},
      "Country":{
       "IdentificationCode":{"_":"DE"}
      }
     }
    },
    "Period":[{
     "StartDate":{"_":"2011-10-04"},
     "StartTime":{"_":"09:30:10+01:00"},
     "EndDate":{"_":"2011-10-04"},
     "EndTime":{"_":"09:30:10+01:00"}
    }]
   },
   "PlannedArrivalTransportEvent":{
    "Location":{
     "LocationTypeCode":{"_":"13"},
     "Address":{
      "StreetName":{"_":"Sandstr. 38-40"},
      "CityName":{"_":"Nurnberg"},
      "Country":{
       "IdentificationCode":{"_":"DE"}
      }
     }
    },
    "Period":[{
     "StartDate":{"_":"2011-10-04"},
     "StartTime":{"_":"15:30:10+01:00"},
     "EndDate":{"_":"2011-10-04"},
     "EndTime":{"_":"18:30:10+01:00"}
    }]
   }
  },{
   "ID":{"_":"3"},
   "PlannedDepartureTransportEvent":{
    "Location":{
     "LocationTypeCode":{"_":"13"},
     "Address":{
      "StreetName":{"_":"Sandstr. 38-40"},
      "CityName":{"_":"Nurnberg"},
      "Country":{
       "IdentificationCode":{"_":"DE"}
      }
     }
    },
    "Period":[{
     "StartDate":{"_":"2011-10-06"},
     "StartTime":{"_":"09:30:10+01:00"},
     "EndDate":{"_":"2011-10-06"},
     "EndTime":{"_":"12:30:10+01:00"}
    }]
   },
   "PlannedArrivalTransportEvent":{
    "Location":{
     "Address":{
      "StreetName":{"_":"Grosse strasse 34"},
      "CityName":{"_":"Nurnberg"},
      "Country":{
       "IdentificationCode":{"_":"DE"}
      }
     }
    },
    "Period":[{
     "StartDate":{"_":"2011-10-06"},
     "StartTime":{"_":"12:30:10+01:00"},
     "EndDate":{"_":"2011-10-06"},
     "EndTime":{"_":"15:30:10+01:00"}
    }]
   }
  }]
 }]
}}